{
  "schemaVersion": "1.0",
  "projectName": "my-saas-app",
  "createdAt": "2025-01-15T09:00:00Z",
  "agents": [
    {
      "id": "cursor",
      "name": "Cursor",
      "kind": "cursor",
      "configPath": ".cursorrules"
    },
    {
      "id": "claude",
      "name": "Claude Code",
      "kind": "claude",
      "configPath": "CLAUDE.md"
    },
    {
      "id": "codex",
      "name": "Codex",
      "kind": "codex",
      "configPath": "AGENTS.md"
    }
  ]
}